{
  "kind": "run",
  "schemaVersion": "1.0.0",
  "id": "build-product-task-5-run-1",
  "workflowId": "build-product",
  "workflowInstanceId": "build-product-2026-03-14T09-49-26-159Z",
  "taskId": "build-product-task-5",
  "stepId": "testing",
  "agentId": "qa-agent",
  "skillId": "integration-test",
  "artifactName": "verification-report",
  "attempt": 1,
  "triggerSource": "workflow_step",
  "status": "succeeded",
  "createdAt": "2026-03-14T09:49:26.222Z",
  "updatedAt": "2026-03-14T09:49:26.225Z",
  "startedAt": "2026-03-14T09:49:26.222Z",
  "completedAt": "2026-03-14T09:49:26.225Z",
  "artifactFile": "tasks/results/build-product-2026-03-14T09-49-26-159Z/05-testing.md",
  "error": null
}