{
  "kind": "run",
  "schemaVersion": "1.0.0",
  "id": "build-product-task-3-run-1",
  "workflowId": "build-product",
  "workflowInstanceId": "build-product-2026-03-14T08-48-04-358Z",
  "taskId": "build-product-task-3",
  "stepId": "architecture",
  "agentId": "architect-agent",
  "skillId": "system-architecture",
  "artifactName": "architecture-blueprint",
  "attempt": 1,
  "triggerSource": "workflow_step",
  "status": "succeeded",
  "createdAt": "2026-03-14T08:48:04.392Z",
  "updatedAt": "2026-03-14T08:48:04.394Z",
  "startedAt": "2026-03-14T08:48:04.392Z",
  "completedAt": "2026-03-14T08:48:04.394Z",
  "artifactFile": "tasks/results/build-product-2026-03-14T08-48-04-358Z/03-architecture.md",
  "error": null
}