{
  "kind": "run",
  "schemaVersion": "1.0.0",
  "id": "build-product-task-4-run-1",
  "workflowId": "build-product",
  "workflowInstanceId": "build-product-2026-03-14T09-54-37-061Z",
  "taskId": "build-product-task-4",
  "stepId": "development",
  "agentId": "engineer-agent",
  "skillId": "code-generation",
  "artifactName": "implementation",
  "attempt": 1,
  "triggerSource": "workflow_step",
  "status": "succeeded",
  "createdAt": "2026-03-14T09:54:37.114Z",
  "updatedAt": "2026-03-14T09:54:37.117Z",
  "startedAt": "2026-03-14T09:54:37.114Z",
  "completedAt": "2026-03-14T09:54:37.117Z",
  "artifactFile": "tasks/results/build-product-2026-03-14T09-54-37-061Z/04-development.md",
  "error": null
}