{
  "kind": "run",
  "schemaVersion": "1.0.0",
  "id": "build-product-task-2-run-1",
  "workflowId": "build-product",
  "workflowInstanceId": "build-product-2026-03-14T09-49-26-159Z",
  "taskId": "build-product-task-2",
  "stepId": "product-design",
  "agentId": "product-agent",
  "skillId": "prd-generation",
  "artifactName": "prd",
  "attempt": 1,
  "triggerSource": "workflow_step",
  "status": "succeeded",
  "createdAt": "2026-03-14T09:49:26.197Z",
  "updatedAt": "2026-03-14T09:49:26.200Z",
  "startedAt": "2026-03-14T09:49:26.197Z",
  "completedAt": "2026-03-14T09:49:26.200Z",
  "artifactFile": "tasks/results/build-product-2026-03-14T09-49-26-159Z/02-product-design.md",
  "error": null
}